{
  "schemaVersion": 1,
  "version": "1.0.0-beta.1",
  "status": "beta",
  "generatedAt": "2026-08-09",
  "topics": [
    {
      "id": "g5-n01",
      "subject": "math",
      "grade": 5,
      "unitId": "g5-unit-01",
      "unitTitle": "Натуральные числа и нуль",
      "order": 1,
      "title": "Натуральное число. Ряд натуральных чисел. Число 0. Изображение натуральных чисел на числовой прямой.",
      "status": "beta"
    },
    {
      "id": "g5-n02",
      "subject": "math",
      "grade": 5,
      "unitId": "g5-unit-01",
      "unitTitle": "Натуральные числа и нуль",
      "order": 2,
      "title": "Позиционная система счисления. Римская нумерация (непозиционная). Десятичная система счисления.",
      "status": "beta"
    },
    {
      "id": "g5-n03",
      "subject": "math",
      "grade": 5,
      "unitId": "g5-unit-01",
      "unitTitle": "Натуральные числа и нуль",
      "order": 3,
      "title": "Сравнение натуральных чисел и нуля. Способы сравнения. Округление натуральных чисел.",
      "status": "beta"
    },
    {
      "id": "g5-n04",
      "subject": "math",
      "grade": 5,
      "unitId": "g5-unit-01",
      "unitTitle": "Натуральные числа и нуль",
      "order": 4,
      "title": "Сложение натуральных чисел, свойство нуля при сложении. Вычитание как действие, обратное сложению.",
      "status": "beta"
    },
    {
      "id": "g5-n05",
      "subject": "math",
      "grade": 5,
      "unitId": "g5-unit-01",
      "unitTitle": "Натуральные числа и нуль",
      "order": 5,
      "title": "Умножение и деление натуральных чисел. Свойства нуля и единицы при умножении. Компоненты действий и проверка результата.",
      "status": "beta"
    },
    {
      "id": "g5-n06",
      "subject": "math",
      "grade": 5,
      "unitId": "g5-unit-01",
      "unitTitle": "Натуральные числа и нуль",
      "order": 6,
      "title": "Переместительное и сочетательное свойства сложения и умножения. Распределительное свойство умножения. Буквы в записях.",
      "status": "beta"
    },
    {
      "id": "g5-n07",
      "subject": "math",
      "grade": 5,
      "unitId": "g5-unit-01",
      "unitTitle": "Натуральные числа и нуль",
      "order": 7,
      "title": "Делители и кратные. Разложение на множители. Простые и составные числа. Признаки делимости на 2, 5, 10, 3, 9. Деление с остатком.",
      "status": "beta"
    },
    {
      "id": "g5-n08",
      "subject": "math",
      "grade": 5,
      "unitId": "g5-unit-01",
      "unitTitle": "Натуральные числа и нуль",
      "order": 8,
      "title": "Степень с натуральным показателем. Запись числа в виде суммы разрядных слагаемых.",
      "status": "beta"
    },
    {
      "id": "g5-n09",
      "subject": "math",
      "grade": 5,
      "unitId": "g5-unit-01",
      "unitTitle": "Натуральные числа и нуль",
      "order": 9,
      "title": "Числовое выражение. Значения выражений, порядок действий. Свойства сложения и умножения при вычислениях.",
      "status": "beta"
    },
    {
      "id": "g5-f01",
      "subject": "math",
      "grade": 5,
      "unitId": "g5-unit-02",
      "unitTitle": "Дроби",
      "order": 1,
      "title": "Дробь как часть величины. Обыкновенные дроби. Правильные и неправильные дроби.",
      "status": "beta"
    },
    {
      "id": "g5-f02",
      "subject": "math",
      "grade": 5,
      "unitId": "g5-unit-02",
      "unitTitle": "Дроби",
      "order": 2,
      "title": "Смешанная дробь: переход к неправильной и выделение целой части. Дроби на числовой прямой.",
      "status": "beta"
    },
    {
      "id": "g5-f03",
      "subject": "math",
      "grade": 5,
      "unitId": "g5-unit-02",
      "unitTitle": "Дроби",
      "order": 3,
      "title": "Основное свойство дроби. Сокращение. Приведение к знаменателю. Сравнение дробей.",
      "status": "beta"
    },
    {
      "id": "g5-f04",
      "subject": "math",
      "grade": 5,
      "unitId": "g5-unit-02",
      "unitTitle": "Дроби",
      "order": 4,
      "title": "Сложение и вычитание дробей. Умножение и деление. Взаимно обратные дроби. Часть целого и целое по части.",
      "status": "beta"
    },
    {
      "id": "g5-f05",
      "subject": "math",
      "grade": 5,
      "unitId": "g5-unit-02",
      "unitTitle": "Дроби",
      "order": 5,
      "title": "Десятичная запись дробей. Представление десятичной дроби как обыкновенной. Сравнение на прямой.",
      "status": "beta"
    },
    {
      "id": "g5-f06",
      "subject": "math",
      "grade": 5,
      "unitId": "g5-unit-02",
      "unitTitle": "Дроби",
      "order": 6,
      "title": "Арифметические действия с десятичными дробями. Округление десятичных дробей.",
      "status": "beta"
    },
    {
      "id": "g5-w01",
      "subject": "math",
      "grade": 5,
      "unitId": "g5-unit-03",
      "unitTitle": "Решение текстовых задач",
      "order": 1,
      "title": "Текстовые задачи арифметическим способом. Логические задачи. Перебор вариантов. Таблицы и схемы.",
      "status": "beta"
    },
    {
      "id": "g5-w02",
      "subject": "math",
      "grade": 5,
      "unitId": "g5-unit-03",
      "unitTitle": "Решение текстовых задач",
      "order": 2,
      "title": "Зависимости величин: скорость, время, расстояние; цена, количество, стоимость. Единицы измерения.",
      "status": "beta"
    },
    {
      "id": "g5-w03",
      "subject": "math",
      "grade": 5,
      "unitId": "g5-unit-03",
      "unitTitle": "Решение текстовых задач",
      "order": 3,
      "title": "Основные задачи на дроби.",
      "status": "beta"
    },
    {
      "id": "g5-w04",
      "subject": "math",
      "grade": 5,
      "unitId": "g5-unit-03",
      "unitTitle": "Решение текстовых задач",
      "order": 4,
      "title": "Представление данных: таблицы, столбчатые диаграммы.",
      "status": "beta"
    },
    {
      "id": "g5-g01",
      "subject": "math",
      "grade": 5,
      "unitId": "g5-unit-04",
      "unitTitle": "Наглядная геометрия",
      "order": 1,
      "title": "Фигуры на плоскости: точка, прямая, отрезок, луч, угол, ломаная, многоугольник, окружность, круг. Виды углов.",
      "status": "beta"
    },
    {
      "id": "g5-g02",
      "subject": "math",
      "grade": 5,
      "unitId": "g5-unit-04",
      "unitTitle": "Наглядная геометрия",
      "order": 2,
      "title": "Длина отрезка и единицы длины. Периметр. Измерение и построение углов транспортиром.",
      "status": "beta"
    },
    {
      "id": "g5-g03",
      "subject": "math",
      "grade": 5,
      "unitId": "g5-unit-04",
      "unitTitle": "Наглядная геометрия",
      "order": 3,
      "title": "Прямоугольник, квадрат, треугольник. Равенство фигур. Клетчатая бумага. Площадь и единицы площади.",
      "status": "beta"
    },
    {
      "id": "g5-g04",
      "subject": "math",
      "grade": 5,
      "unitId": "g5-unit-04",
      "unitTitle": "Наглядная геометрия",
      "order": 4,
      "title": "Параллелепипед, куб, многогранники. Развёртки. Модели многогранников.",
      "status": "beta"
    },
    {
      "id": "g5-g05",
      "subject": "math",
      "grade": 5,
      "unitId": "g5-unit-04",
      "unitTitle": "Наглядная геометрия",
      "order": 5,
      "title": "Объём прямоугольного параллелепипеда и куба. Единицы измерения объёма.",
      "status": "beta"
    },
    {
      "id": "g6-n01",
      "subject": "math",
      "grade": 6,
      "unitId": "g6-unit-01",
      "unitTitle": "Натуральные числа",
      "order": 1,
      "title": "Арифметические действия с многозначными натуральными числами.",
      "status": "beta"
    },
    {
      "id": "g6-n02",
      "subject": "math",
      "grade": 6,
      "unitId": "g6-unit-01",
      "unitTitle": "Натуральные числа",
      "order": 2,
      "title": "Числовые выражения, порядок действий, использование скобок.",
      "status": "beta"
    },
    {
      "id": "g6-n03",
      "subject": "math",
      "grade": 6,
      "unitId": "g6-unit-01",
      "unitTitle": "Натуральные числа",
      "order": 3,
      "title": "Переместительное, сочетательное свойства сложения и умножения. Распределительное свойство умножения относительно сложения.",
      "status": "beta"
    },
    {
      "id": "g6-n04",
      "subject": "math",
      "grade": 6,
      "unitId": "g6-unit-01",
      "unitTitle": "Натуральные числа",
      "order": 4,
      "title": "Округление натуральных чисел. Прикидка и проверка вычислений.",
      "status": "beta"
    },
    {
      "id": "g6-n05",
      "subject": "math",
      "grade": 6,
      "unitId": "g6-unit-01",
      "unitTitle": "Натуральные числа",
      "order": 5,
      "title": "Делители и кратные. Простые и составные числа. Разложение на простые множители.",
      "status": "beta"
    },
    {
      "id": "g6-n06",
      "subject": "math",
      "grade": 6,
      "unitId": "g6-unit-01",
      "unitTitle": "Натуральные числа",
      "order": 6,
      "title": "Наибольший общий делитель и наименьшее общее кратное двух числа. Алгоритмы НОД и НОК.",
      "status": "beta"
    },
    {
      "id": "g6-n07",
      "subject": "math",
      "grade": 6,
      "unitId": "g6-unit-01",
      "unitTitle": "Натуральные числа",
      "order": 7,
      "title": "Делимость суммы и произведения. Деление с остатком.",
      "status": "beta"
    },
    {
      "id": "g6-n08",
      "subject": "math",
      "grade": 6,
      "unitId": "g6-unit-01",
      "unitTitle": "Натуральные числа",
      "order": 8,
      "title": "Исследование делимости на 4 и 6. Чётность суммы и произведения. Логика и контрпримеры.",
      "status": "beta"
    },
    {
      "id": "g6-n09",
      "subject": "math",
      "grade": 6,
      "unitId": "g6-unit-01",
      "unitTitle": "Натуральные числа",
      "order": 9,
      "title": "Текстовые задачи на делимость арифметическим способом. Перебор вариантов.",
      "status": "beta"
    },
    {
      "id": "g6-g01",
      "subject": "math",
      "grade": 6,
      "unitId": "g6-unit-02",
      "unitTitle": "Наглядная геометрия. Прямые на плоскости",